{
  "document_id": "1223880104_bb83e9b1",
  "document_type": "提示性公告",
  "issuer_profile": {
    "issuer_name": null,
    "issuer_name_normalized": null,
    "stock_code": null,
    "exchange": "上交所",
    "board": "主板",
    "legal_representative": null,
    "establishment_date": null,
    "registered_capital": {
      "value": null,
      "unit": "万元",
      "currency": "CNY"
    },
    "registered_address": null,
    "industry": null,
    "main_business": null,
    "source_evidence_id": null
  },
  "ownership_structure": {
    "controlling_shareholder": [],
    "actual_controller": [],
    "concerted_action_flag": false,
    "top_shareholders": []
  },
  "financials": [],
  "fund_raising_projects": [],
  "risk_items": [],
  "compliance_items": [],
  "evidence_index": []
}